id,Tale,Title,Author,Date,Format,Language,FirstPublicationLocation,Notes
393,Ghost Stories,cubilia curae,Marjorie Brand-Hardy,2008,Novel,English,Singapore,
394,The Fox and the Grapes,at nulla suspendisse,Nerissa Buttner,1999,Novel,English,Japan,
395,The Princess and the Pea,scelerisque mauris sit amet,Ruby Banger,1994,Novel,English,Malaysia,ut rhoncus aliquet pulvinar sed nisl nunc rhoncus dui vel sem sed
396,Jack and the Beanstalk,in faucibus orci luctus et,Kalila Duke,1986,Novel,English,Italy,
397,Hansel and Gretel,non mauris,Devan Fay,2006,Novel,English,Russia,nunc proin at turpis a pede posuere nonummy integer non
398,Belling the Cat,mi pede malesuada in imperdiet et,Joeann Brokenbrow,1994,Short story,English,Malaysia,pretium nisl
399,The Fisherman and his Wife,malesuada in imperdiet et,Jehanna Madle,1985,Novel,English,United Kingdom,varius integer ac leo pellentesque ultrices
400,Goldilocks and the Three Bears,sit amet consectetuer adipiscing elit proin,Sheeree Dowtry,2005,Novel,English,Spain,justo eu massa donec dapibus duis at velit eu
401,The Fisherman and his Wife,pharetra magna,Hurley Gillibrand,2011,Novel,English,Norway,etiam pretium iaculis justo in hac habitasse platea dictumst
402,Fractured Fairy Tales,amet sapien,Fremont Kopps,2006,Novel,English,Hungary,ipsum primis
403,Hans in Luck,platea dictumst maecenas,Arlen Kynan,2004,Short story,English,Serbia,
404,Belling the Cat,pede libero,Corinna Steedman,1989,Short story,English,Thailand,ut nulla sed accumsan felis ut at dolor
405,Aesops Fables,ullamcorper augue a,Barron Chandlar,1997,Novel,English,Indonesia,
406,Little Red Riding Hood,lorem id,Monika Delgadillo,2001,Novel,English,Spain,pede ac diam cras pellentesque volutpat
407,Henny Penny,libero quis orci nullam,Lurleen Bankes,2008,Short story,English,Portugal,lacinia sapien quis libero nullam sit amet
408,The Lion and the Mouse,penatibus et,Sallee D'Aulby,1993,Novel,English,Norway,feugiat et eros vestibulum
409,The Grasshopper and the Ants,eu felis fusce posuere felis,Rae Vasilyevski,1984,Novel,English,France,nisi nam ultrices libero
410,Seven Swabians,vivamus vel nulla eget,Ottilie St. Ledger,1987,Short story,English,France,
411,Fractured Fairy Tales,eget rutrum at lorem integer,Mac Bushell,2005,Novel,English,Mexico,nonummy maecenas tincidunt
412,Gingerbread Man,pharetra magna ac,Theo Philliphs,2003,Novel,English,Malaysia,erat id mauris vulputate
413,Puss in Boots,dui nec nisi volutpat eleifend donec,Kerr Libermore,2009,Novel,English,Nepal,fermentum donec ut mauris eget massa
414,The Princess and the Pea,sit amet cursus id turpis,Newton Ickovicz,1998,Short story,English,Russia,velit nec nisi vulputate
415,The Bremen Town Musicians,lorem ipsum dolor sit,Ludovico Stuehmeier,1996,Novel,English,Dominica,eros suspendisse accumsan tortor quis turpis sed ante vivamus tortor duis
416,Henny Penny,luctus et ultrices posuere cubilia,Cecil McKerron,2003,Short story,English,Malaysia,augue luctus tincidunt
417,The Grasshopper and the Ants,velit donec diam,Bren Kempson,2012,Short story,English,Haiti,sit amet consectetuer adipiscing elit proin interdum mauris non ligula pellentesque
418,The Teeny Tiny Woman,nisi at nibh in hac habitasse,Mario Prene,2009,Novel,English,Haiti,nulla justo aliquam quis turpis
419,Trickster Tales,in sagittis dui vel nisl,Lucita Jordine,2009,Novel,English,Barbados,venenatis lacinia
420,Rapunzel,curabitur convallis duis consequat,Patti Dummer,2010,Novel,English,Dominica,orci pede venenatis non sodales
421,Brer Rabbit,id ligula suspendisse ornare consequat lectus,Christian Licquorish,2006,Short story,English,Sweden,ut at dolor quis odio consequat varius integer ac leo
422,The Grasshopper and the Ants,nec euismod,Ysabel Braybrooke,2010,Novel,English,Haiti,sodales scelerisque mauris sit amet eros suspendisse accumsan tortor quis turpis
423,Gingerbread Man,sagittis nam congue risus,Rance Marqyes,1985,Novel,English,Romania,aliquam erat
424,The Lion and the Mouse,sapien a libero nam dui proin,Angil Braund,2012,Novel,English,United States,amet sapien dignissim vestibulum vestibulum ante ipsum primis in faucibus orci
425,Little Red Riding Hood,posuere cubilia,Lisetta Garatty,1983,Short story,English,Dominica,nulla suspendisse potenti cras in purus eu
426,The Princess and the Pea,lorem id ligula suspendisse ornare,Dix Mattsson,2008,Short story,English,Mexico,sollicitudin ut suscipit
427,Henny Penny,lorem ipsum dolor sit amet,Alejandrina Shemwell,2010,Short story,English,Germany,sollicitudin vitae consectetuer eget rutrum at lorem
428,Snow White,rutrum rutrum,Cornelius Bainton,2003,Short story,English,United States,vivamus vel nulla eget eros elementum
429,The Fisherman and his Wife,quam pede lobortis,Tobe Napoli,1985,Novel,English,Dominica,quis turpis sed
430,Little Red Riding Hood,vestibulum ante,Freemon Mccaull,2003,Novel,English,Barbados,libero quis orci
431,Sleeping Beauty,sapien ut nunc vestibulum ante,Vina Duchatel,2002,Short story,English,Greece,tempor convallis nulla neque libero convallis eget eleifend luctus ultricies eu
432,The Bremen Town Musicians,lectus in,Gaby Peppett,2009,Novel,English,Estonia,volutpat sapien arcu sed augue aliquam erat volutpat in congue etiam justo
433,The Princess and the Pea,nisl nunc rhoncus,Winfield Sanzio,2002,Novel,English,Nepal,morbi a ipsum integer a nibh in quis justo
434,Puss in Boots,bibendum felis sed,Koressa Tunnah,1990,Short story,English,Norway,mollis molestie lorem quisque ut erat curabitur gravida nisi
435,Snow White,rutrum nulla nunc purus phasellus in,Raimondo Vamplers,1997,Short story,English,Mexico,lorem vitae mattis nibh ligula nec
436,Stone Soup,donec odio,Merle Fishe,2006,Novel,English,Mexico,in magna
437,The Ugly Duckling,laoreet ut,Maurine Hemphrey,2003,Novel,English,Spain,neque vestibulum eget vulputate ut
438,Little Red Riding Hood,orci pede venenatis non,Gwenora Dowderswell,2010,Short story,English,Nepal,adipiscing elit
439,The Town Mouse and the Country Mouse,sodales scelerisque,Avery Guilleton,2009,Novel,English,Turkey,primis in faucibus orci luctus et ultrices
440,Little Red Riding Hood,ut suscipit a,Walton Gussie,2008,Short story,English,Estonia,
441,The Princess and the Pea,a libero nam,Ansel Alf,2001,Short story,English,Portugal,semper rutrum nulla nunc purus phasellus in felis
442,Rapunzel,neque vestibulum eget,Ciel McGraw,1977,Novel,English,United Kingdom,
443,The Fox and the Grapes,gravida nisi at nibh,Norry Powling,1993,Short story,English,Haiti,sit amet
444,The Princess and the Pea,erat nulla,Marietta Guilloton,1998,Short story,English,Dominica,quam suspendisse potenti nullam
445,Fractured Fairy Tales,odio porttitor id consequat in consequat,Elga Schimank,1998,Short story,English,United States,ut erat curabitur gravida nisi
446,Sleeping Beauty,ultrices erat tortor sollicitudin,Issy Bog,2003,Novel,English,Greece,curabitur convallis duis consequat dui nec nisi volutpat eleifend
447,Seven Swabians,ac nulla sed vel enim,Spense Downse,1999,Novel,English,Nepal,sed sagittis nam congue
448,The Teeny Tiny Woman,non pretium quis lectus suspendisse,Rory Lemmens,1984,Short story,English,Greece,faucibus orci luctus et
449,The Lion and the Mouse,pellentesque eget nunc donec,Cathy Leyborne,1994,Novel,English,Jamaica,morbi quis tortor id
450,Cinderella,augue a suscipit nulla elit ac,Laryssa Eaves,1995,Short story,English,Thailand,
451,Stone Soup,pharetra magna,Aileen Wadlow,2011,Short story,English,Singapore,sem mauris laoreet ut rhoncus aliquet
452,The Fisherman and his Wife,bibendum morbi,Sydelle Rettie,2000,Novel,English,Japan,iaculis congue vivamus
453,Gingerbread Man,eu interdum eu tincidunt in leo,Rosabella Brizland,2004,Short story,English,Grenada,
454,Brer Rabbit,nam congue,Joel Eye,2011,Novel,English,China,pellentesque eget nunc
455,The Fisherman and his Wife,est quam pharetra magna ac,Celestina Kupker,2006,Novel,English,Hungary,
456,Seven Swabians,nibh in hac habitasse,Noelyn Yakebowitch,1995,Short story,English,Iceland,ipsum ac tellus semper interdum mauris ullamcorper purus sit amet nulla
457,Gingerbread Man,ligula nec sem duis aliquam convallis,Darbee Gunson,2003,Short story,English,France,
458,Fractured Fairy Tales,dapibus at diam nam tristique tortor,Brantley Sygroves,2000,Short story,English,Estonia,sagittis dui vel nisl duis ac nibh fusce lacus purus
459,Aesops Fables,risus semper porta volutpat quam,Nora Lightbowne,2009,Novel,English,Barbados,dolor sit
460,Puss in Boots,non mauris morbi,Coop Latan,2011,Novel,English,Dominica,ut massa quis
461,Fractured Fairy Tales,magna bibendum,Brooke Roderick,1995,Novel,English,Russia,lectus in est risus
462,Hans in Luck,pede ullamcorper augue a,Nada Polet,2007,Short story,English,Jamaica,
463,Henny Penny,nec nisi volutpat eleifend,Adria Angrick,1999,Novel,English,Nepal,
464,Chicken Little,lobortis est phasellus sit amet erat,Arabelle Stayte,1997,Novel,English,Serbia,magna vestibulum
465,Stone Soup,ac consequat,Peyton Copland,2009,Short story,English,Greece,in faucibus orci luctus et
466,Henny Penny,diam vitae quam suspendisse,Curr Deniske,1997,Short story,English,United States,convallis duis consequat dui nec nisi volutpat eleifend donec ut dolor
467,Stone Soup,montes nascetur ridiculus mus vivamus,Andros Troop,2002,Novel,English,Germany,
468,Aesops Fables,in consequat ut nulla sed accumsan,Jamesy Henworth,2004,Short story,English,Turkey,nulla sed vel enim sit amet
469,The Princess and the Pea,interdum eu tincidunt in,Claudetta Geratt,1987,Novel,English,Turkey,
470,Brer Rabbit,eros suspendisse accumsan tortor quis,Pietrek Bram,1994,Novel,English,Norway,in quam fringilla rhoncus mauris enim leo rhoncus sed vestibulum sit
471,The Grasshopper and the Ants,eu massa,Corrianne Sudddard,2004,Novel,English,Germany,ultrices posuere cubilia curae donec pharetra magna vestibulum aliquet ultrices erat
472,The Grasshopper and the Ants,hac habitasse,Erny Dowzell,2000,Novel,English,Russia,mus etiam vel augue vestibulum rutrum rutrum neque aenean auctor gravida
473,Little Red Riding Hood,nunc purus,Llewellyn Sussems,2009,Short story,English,Hungary,praesent blandit nam nulla integer pede justo
474,The Teeny Tiny Woman,ut mauris eget,Joe Stoeck,2008,Short story,English,Iceland,
475,Goldilocks and the Three Bears,accumsan odio,Fifine Caplan,2011,Novel,English,Portugal,ultrices mattis odio donec
476,Trickster Tales,mauris viverra diam vitae,Alford Sinisbury,2013,Short story,English,Nepal,porttitor lacus at turpis donec posuere metus
477,The Bremen Town Musicians,non velit nec nisi vulputate nonummy,Onfre Frowen,1993,Short story,English,Singapore,justo etiam pretium iaculis justo in hac habitasse platea
478,Brer Rabbit,mattis odio donec,Sherlocke Ingree,1996,Short story,English,Portugal,lacinia sapien quis libero nullam sit amet turpis elementum ligula
479,Hansel and Gretel,sapien quis libero nullam sit,Forrest Shatford,1993,Novel,English,Portugal,
480,Hans in Luck,curae mauris viverra diam vitae quam,Shep Clethro,2008,Short story,English,Japan,
481,The Grasshopper and the Ants,in faucibus orci,Avery MacKenzie,2001,Novel,English,Sweden,ut nunc
482,The Ugly Duckling,aliquet pulvinar,Channa Kayser,1992,Short story,English,Barbados,
483,Little Red Riding Hood,vivamus vestibulum sagittis sapien cum,Murray Salaman,2002,Short story,English,United States,in consequat ut nulla
484,The Lion and the Mouse,eros viverra eget congue eget semper,Kimball Ferronel,1986,Novel,English,Barbados,lacus at turpis donec posuere metus vitae ipsum aliquam
485,The Princess and the Pea,nulla elit,Vachel Endicott,2008,Short story,English,Malaysia,ac tellus semper interdum mauris ullamcorper purus sit amet
486,Gingerbread Man,tellus semper interdum mauris,Giavani Brehat,1997,Novel,English,Indonesia,
487,Snow White,velit vivamus,Gareth Mulheron,2012,Short story,English,United States,ante ipsum primis
488,The Ugly Duckling,maecenas tincidunt,Dacie Manning,2000,Short story,English,Malaysia,sed vestibulum sit
489,Henny Penny,vulputate elementum,Larisa Grzesiewicz,2002,Short story,English,Romania,vel est donec odio justo
490,Rapunzel,sed tristique,Melessa Truesdale,2008,Novel,English,Jamaica,nulla suscipit
491,Hans in Luck,odio condimentum id luctus nec,Raoul Land,2009,Novel,English,Thailand,vestibulum ante ipsum primis in
492,Tom Thumb,risus auctor sed,Gilburt Beech,2009,Novel,English,Hungary,mus etiam vel
493,Hans in Luck,rutrum ac lobortis vel,Delphine Dallosso,2000,Novel,English,United States,donec vitae nisi nam ultrices
494,Seven Swabians,massa donec dapibus duis at velit,Janeva Shapland,1999,Short story,English,Singapore,ultrices posuere cubilia curae donec
495,The Little Red Hen,porttitor pede justo eu massa,Cinda Klauber,1993,Novel,English,Italy,orci vehicula condimentum
496,Seven Swabians,et magnis dis parturient,Ange Gheeorghie,2007,Novel,English,United Kingdom,nisl nunc rhoncus dui vel sem
497,Cinderella,odio in hac,Torrence Whiffin,1987,Novel,English,Iceland,curae donec pharetra magna vestibulum aliquet
498,Rapunzel,pellentesque quisque porta volutpat erat quisque,Ali Mattiussi,2003,Short story,English,Spain,vestibulum aliquet ultrices erat tortor sollicitudin mi sit amet lobortis sapien sapien
499,Stone Soup,dui luctus rutrum nulla tellus in,Pennie Ketteridge,2012,Short story,English,Greece,natoque penatibus et magnis
500,Snow White,adipiscing elit,Marty Buscombe,1986,Novel,English,Dominica,
501,Sleeping Beauty,felis sed interdum venenatis,Olivette Palffrey,1985,Novel,English,Hungary,nisl ut volutpat sapien arcu sed augue aliquam erat volutpat
502,Aesops Fables,rhoncus mauris enim leo rhoncus,Kristin Alywin,1992,Short story,English,India,hac habitasse
503,The Princess and the Pea,praesent lectus vestibulum quam sapien varius,Ivor Hassen,2008,Novel,English,Japan,
504,Hans in Luck,nam congue risus,Emmy Poll,1994,Short story,English,Romania,volutpat dui maecenas
505,Goldilocks and the Three Bears,nullam porttitor lacus,Melva Torres,2010,Novel,English,Greece,congue eget semper rutrum
506,Brer Rabbit,suscipit ligula in lacus curabitur at,Kirstin Gresly,2010,Novel,English,Iceland,velit vivamus vel nulla eget eros elementum
507,The Little Red Hen,vivamus tortor,Nettie Silverwood,2006,Novel,English,Malaysia,ut suscipit a feugiat et eros vestibulum ac est
508,The Town Mouse and the Country Mouse,sit amet eros suspendisse accumsan,Kailey Toe,1993,Novel,English,Turkey,eget vulputate ut ultrices vel augue vestibulum
509,Gingerbread Man,nec nisi,Tatiana Flux,1992,Novel,English,Iceland,justo sollicitudin ut suscipit a feugiat
510,Fractured Fairy Tales,sem sed,Latia Menear,2008,Novel,English,Nepal,augue quam sollicitudin vitae consectetuer eget rutrum at
511,Brer Rabbit,ac est lacinia nisi,Sarine Grizard,1997,Short story,English,Malaysia,sit amet lobortis sapien sapien non mi integer ac neque duis
512,Brer Rabbit,elementum nullam varius nulla facilisi cras,Doralin Dibben,1996,Novel,English,Nepal,erat vestibulum sed magna at nunc commodo placerat
513,Belling the Cat,elit proin interdum mauris non,Carolina Jamrowicz,2003,Novel,English,Grenada,molestie sed justo pellentesque viverra pede ac diam cras pellentesque
514,Seven Swabians,blandit nam,Harbert Daddow,2004,Short story,English,India,nulla quisque arcu libero rutrum ac lobortis vel dapibus at diam
515,The Little Red Hen,erat quisque erat eros viverra,Franzen Chatenier,1995,Novel,English,Italy,dolor vel est donec odio justo sollicitudin ut suscipit a
516,Fractured Fairy Tales,gravida sem praesent,Lola Entwhistle,1993,Novel,English,Italy,
517,Belling the Cat,mattis pulvinar nulla pede ullamcorper augue,Valerie Talks,1998,Short story,English,Hungary,
518,Snow White,pede morbi porttitor lorem,Sarette Rowbury,1973,Novel,English,United States,
519,The Little Red Hen,tortor duis mattis egestas,Alvis Chrispin,2001,Novel,English,Vietnam,vestibulum sed magna at nunc commodo placerat praesent
520,Belling the Cat,vel dapibus at diam,Vincenz Pamment,1997,Novel,English,Singapore,venenatis turpis enim blandit mi in porttitor pede justo
521,The Teeny Tiny Woman,in sapien iaculis congue,Cherey Cod,2012,Short story,English,France,ac diam cras pellentesque
522,Snow White,imperdiet sapien urna pretium nisl ut,Gorden Hitter,1988,Novel,English,Jamaica,
523,Stone Soup,consequat metus sapien,Zola Hunnywell,1957,Novel,English,France,donec vitae nisi nam ultrices libero non mattis pulvinar nulla
524,Puss in Boots,rutrum neque aenean auctor gravida sem,Elianora Rucklidge,2012,Novel,English,Serbia,at feugiat non pretium quis lectus suspendisse
525,Henny Penny,nunc donec,Christophorus Southers,1988,Novel,English,Iceland,tincidunt nulla mollis molestie lorem quisque ut erat curabitur gravida nisi
526,Hans in Luck,commodo placerat praesent,Marj Falco,2009,Short story,English,Greece,libero nullam sit amet turpis elementum ligula
527,Trickster Tales,lacus at velit vivamus vel,Veronike Christie,1999,Novel,English,Russia,ut dolor morbi vel lectus
528,The Lion and the Mouse,cras in,Ashlen Tregiddo,1991,Novel,English,United States,platea dictumst maecenas ut massa quis
529,The Town Mouse and the Country Mouse,at diam nam,Ebonee Hallad,2004,Short story,English,Italy,platea dictumst
530,Cinderella,justo in blandit,Nollie Ankrett,1997,Novel,English,United States,neque duis bibendum morbi
531,Tom Thumb,viverra diam,Gabriel O'Siaghail,1992,Short story,English,Mexico,vel augue vestibulum rutrum rutrum neque
532,Tom Thumb,mauris eget massa tempor,Manon Squier,1996,Short story,English,Grenada,velit eu est congue elementum in hac habitasse platea dictumst morbi vestibulum
533,Seven Swabians,libero nullam sit amet turpis elementum,Novelia Weddeburn,1996,Short story,English,Spain,convallis tortor risus dapibus augue
534,Fractured Fairy Tales,vitae nisl aenean lectus,Dalis Mardall,1996,Short story,English,United States,
535,Jack and the Beanstalk,quis justo,Nadya Aizik,2007,Short story,English,Romania,sit amet eleifend pede libero quis orci nullam
536,Stone Soup,vulputate luctus cum,Danni Selcraig,1992,Short story,English,Russia,eget orci vehicula condimentum curabitur in libero ut massa volutpat convallis morbi
537,Snow White,venenatis turpis enim blandit,Hillie Nuth,1994,Short story,English,Malaysia,
538,The Town Mouse and the Country Mouse,velit donec,Kareem Houltham,1994,Novel,English,Haiti,massa id nisl venenatis lacinia aenean sit amet
539,Little Red Riding Hood,nibh fusce lacus purus,Kerby Westoll,1995,Short story,English,United States,elementum eu interdum eu tincidunt in leo maecenas pulvinar lobortis
540,Stone Soup,nulla pede ullamcorper augue a,Burke D'eye,2004,Short story,English,India,et magnis dis parturient montes nascetur ridiculus mus etiam
541,Hansel and Gretel,morbi vel lectus in,Annalise Losselyong,1997,Short story,English,Greece,
542,Ghost Stories,amet eros suspendisse accumsan tortor,Dennis Wickwar,2001,Novel,English,Romania,nulla tempus vivamus in felis
543,Trickster Tales,nulla elit ac nulla sed vel,Natalie Kienl,1992,Short story,English,Spain,augue vestibulum ante ipsum primis in faucibus orci
544,Ghost Stories,nulla sed accumsan felis ut at,Stanley Cardenoza,2012,Novel,English,United States,turpis eget elit sodales scelerisque mauris sit amet
545,The Fisherman and his Wife,pellentesque viverra pede ac,Sinclair Hawes,1997,Short story,English,Jamaica,
546,Stone Soup,fusce consequat,Audre Gatiss,2006,Novel,English,Portugal,
547,The Lion and the Mouse,felis ut at dolor quis odio,Orsola Lazer,1984,Novel,English,Indonesia,vestibulum aliquet ultrices erat
548,The Ugly Duckling,condimentum id luctus nec molestie sed,Ree Lockier,2001,Novel,English,Turkey,justo eu massa donec
549,Chicken Little,in faucibus orci luctus et ultrices,Dyanna Chalmers,1970,Short story,English,Germany,et magnis dis parturient montes
550,The Fisherman and his Wife,nibh in hac habitasse platea dictumst,Zita Cowap,2001,Novel,English,Barbados,lorem quisque ut erat
551,The Grasshopper and the Ants,phasellus sit amet erat nulla,Gill Easdon,2003,Novel,English,Indonesia,amet sem fusce consequat nulla nisl nunc nisl duis
552,The Teeny Tiny Woman,amet nulla quisque arcu libero rutrum,Emanuele Hackford,2007,Short story,English,China,lorem id ligula suspendisse ornare consequat lectus in est risus auctor sed
553,Trickster Tales,pede justo eu,Allistir Yong,1995,Novel,English,Turkey,rutrum ac lobortis vel dapibus at diam nam
554,Cinderella,libero nam,Elisabetta Reaman,1992,Novel,English,Iceland,lectus in est risus auctor sed tristique
555,The Fisherman and his Wife,porttitor id,Baily Wildman,1970,Novel,English,Barbados,nisl aenean lectus pellentesque eget nunc donec quis
556,Stone Soup,et magnis,Bearnard Thomerson,2013,Novel,English,Singapore,magna vestibulum aliquet ultrices erat tortor sollicitudin
557,Stone Soup,leo pellentesque ultrices mattis odio donec,Padget Signorelli,2010,Novel,English,China,amet nulla quisque arcu libero rutrum ac lobortis vel dapibus
558,Sleeping Beauty,convallis tortor risus,Harlin Manston,2007,Short story,English,Barbados,eu sapien cursus vestibulum proin eu mi nulla ac enim in tempor
559,Snow White,eleifend quam a odio,Ronnie Withringten,1994,Short story,English,Malaysia,
560,The Bremen Town Musicians,tincidunt ante,Kalvin Lysaght,2012,Novel,English,Haiti,
561,The Little Red Hen,maecenas rhoncus aliquam lacus,Jonathan Kubat,1992,Novel,English,Turkey,sagittis sapien cum sociis natoque penatibus et
562,Hansel and Gretel,faucibus orci luctus et ultrices,Cheslie Scollick,1992,Short story,English,Nepal,curae nulla dapibus dolor vel
563,Rapunzel,sapien quis,Banky Backs,1997,Novel,English,Vietnam,quis justo maecenas rhoncus aliquam lacus morbi
564,Jack and the Beanstalk,vestibulum velit,Bourke Kik,1988,Short story,English,Serbia,mi pede malesuada in imperdiet et commodo vulputate justo
565,Snow White,posuere nonummy,Kurt Senn,1995,Novel,English,Iceland,justo sollicitudin ut suscipit a feugiat et eros vestibulum ac est lacinia
566,The Princess and the Pea,odio porttitor id consequat in consequat,Bella Beacham,1988,Short story,English,Thailand,leo odio condimentum id luctus nec
567,The Fox and the Grapes,amet eleifend pede,Xenos Weson,2012,Short story,English,Norway,
568,The Ugly Duckling,mauris laoreet,Roselia Maharg,1998,Novel,English,Germany,sapien iaculis
569,The Teeny Tiny Woman,sit amet,Brien Cronshaw,1993,Short story,English,Romania,justo pellentesque viverra pede ac diam cras pellentesque volutpat dui
570,The Fisherman and his Wife,in felis eu sapien cursus vestibulum,Dania Buntine,1984,Novel,English,Grenada,maecenas ut massa quis augue luctus tincidunt nulla mollis
571,Snow White,blandit non interdum,Davidde Gillis,2011,Novel,English,Grenada,dictumst etiam faucibus cursus urna
572,Cinderella,non mattis pulvinar nulla,Edgar Trembey,2005,Novel,English,Turkey,eleifend donec ut dolor morbi vel lectus
573,Fractured Fairy Tales,non velit nec nisi vulputate nonummy,Obediah Maisey,1994,Short story,English,Norway,pulvinar nulla pede ullamcorper augue a suscipit nulla elit
574,Snow White,quis justo,Erroll Gianullo,2007,Novel,English,Mexico,libero rutrum ac lobortis vel dapibus at diam nam
575,Fractured Fairy Tales,ultrices enim lorem ipsum dolor,Justina Cranton,2004,Short story,English,Thailand,mus vivamus vestibulum sagittis sapien cum
576,Tom Thumb,fermentum justo nec condimentum,Mateo Getley,2005,Novel,English,Italy,nulla dapibus
577,Hans in Luck,congue elementum in,Kathryne Pichan,2004,Short story,English,Italy,auctor sed tristique in tempus
578,Goldilocks and the Three Bears,cubilia curae nulla dapibus dolor vel,Jacky Sammes,1984,Novel,English,Serbia,pede malesuada in imperdiet et
579,Snow White,vivamus metus arcu adipiscing molestie hendrerit,Parrnell Coarser,1999,Short story,English,Dominica,habitasse platea dictumst
580,Brer Rabbit,nunc nisl duis bibendum,Katleen Edgin,2013,Novel,English,United States,
581,The Ugly Duckling,nam nulla integer pede,Kingsley Luker,1993,Short story,English,United States,ut massa quis augue luctus tincidunt nulla mollis molestie
582,Stone Soup,morbi odio,Cullan Kays,2013,Short story,English,Dominica,duis mattis egestas metus aenean fermentum
583,Fractured Fairy Tales,dictumst maecenas ut massa quis,Gates Whitmarsh,2006,Short story,English,Barbados,
584,The Little Red Hen,posuere cubilia curae mauris viverra diam,Ashlee Dainton,2012,Novel,English,Malaysia,vel augue vestibulum ante ipsum primis
585,The Lion and the Mouse,sem praesent id massa,Merci Crampin,2011,Short story,English,Jamaica,odio odio elementum eu
586,Hans in Luck,praesent lectus vestibulum quam sapien,Waylon Kerfoot,2010,Short story,English,Portugal,erat volutpat in congue etiam justo etiam pretium iaculis justo in
587,Trickster Tales,suspendisse potenti,Trix St Quenin,1997,Short story,English,Thailand,pede ullamcorper augue a
588,Seven Swabians,aenean auctor gravida sem praesent id,Kristan Learmont,2005,Novel,English,Serbia,orci pede venenatis
589,Sleeping Beauty,consequat nulla nisl nunc nisl duis,Kristofor Summerson,2009,Short story,English,Singapore,nunc rhoncus dui vel sem sed sagittis nam
590,Trickster Tales,ultrices posuere,Beulah Jasper,1993,Short story,English,Barbados,odio elementum eu interdum eu tincidunt in
591,The Town Mouse and the Country Mouse,vitae nisi nam ultrices libero,Lily Asple,1994,Short story,English,United States,quis turpis eget elit sodales
592,Jack and the Beanstalk,quis augue luctus,Chrissy Cruikshank,1994,Short story,English,Hungary,erat curabitur gravida
593,The Ugly Duckling,tempus vivamus in felis,Samara Cavill,2012,Short story,English,Singapore,pellentesque at nulla suspendisse potenti cras in purus eu magna vulputate
594,Henny Penny,fusce consequat nulla nisl nunc nisl,Kerk Kells,1987,Short story,English,Greece,
595,Sleeping Beauty,odio justo sollicitudin,Jakob Crebbin,2000,Novel,English,Nepal,quam suspendisse potenti
