id,Tale,Title,Author,Date,Format,Language,FirstPublicationLocation,Notes
799,The Fisherman and his Wife,integer pede justo lacinia,Franz Sumpter,1987,Short story,English,Estonia,donec semper sapien a libero nam dui proin leo odio
800,The Town Mouse and the Country Mouse,semper est quam,Teddy Battey,2012,Short story,English,Turkey,elit proin interdum mauris
801,Hans in Luck,at nulla suspendisse potenti cras in,Cristin Wrankmore,1994,Short story,English,Vietnam,id mauris vulputate elementum nullam varius nulla facilisi cras
802,Tom Thumb,semper porta volutpat quam pede lobortis,Meade Kubala,1992,Novel,English,Japan,tincidunt ante vel ipsum praesent blandit lacinia erat vestibulum sed
803,Trickster Tales,nisl duis ac nibh,Carmine Boler,2007,Short story,English,United States,semper interdum mauris ullamcorper purus sit amet nulla quisque arcu libero rutrum
804,Fractured Fairy Tales,sit amet justo morbi,Glory Wilshire,2005,Short story,English,Germany,donec semper sapien a libero
805,Stone Soup,vivamus vestibulum sagittis sapien,Ignacio Laible,2007,Short story,English,Nepal,curae donec pharetra magna vestibulum aliquet ultrices erat tortor sollicitudin
806,Stone Soup,placerat praesent blandit nam nulla integer,Dillie Bugbird,1992,Novel,English,Spain,id mauris vulputate elementum nullam varius nulla facilisi cras non
807,Tom Thumb,ac nulla,Carson Parell,1993,Novel,English,Japan,mi integer ac
808,Little Red Riding Hood,consequat metus sapien ut nunc vestibulum,Stavro Breheny,2005,Short story,English,Grenada,nunc vestibulum ante ipsum primis in faucibus orci luctus et ultrices
809,Fractured Fairy Tales,etiam faucibus cursus urna ut tellus,Dara Wooderson,2009,Short story,English,Turkey,lacinia erat vestibulum sed magna at nunc commodo placerat
810,Sleeping Beauty,porttitor id consequat in consequat ut,Nyssa Gallyhaock,1992,Novel,English,Sweden,
811,Jack and the Beanstalk,leo rhoncus,Ebenezer Cadden,2008,Novel,English,Hungary,eu orci mauris lacinia sapien quis libero nullam sit amet turpis elementum
812,Fractured Fairy Tales,non velit donec diam neque,Dyana Horsell,1987,Short story,English,Italy,tincidunt nulla mollis molestie lorem
813,Chicken Little,et magnis dis parturient,Xever Penhaligon,2007,Short story,English,Singapore,nisl duis bibendum felis sed interdum venenatis turpis enim blandit mi in
814,Goldilocks and the Three Bears,odio in,Teddy Carlton,1986,Short story,English,Serbia,est quam pharetra magna ac consequat
815,The Fox and the Grapes,elit proin,Griselda Satterfitt,1999,Short story,English,China,rutrum neque aenean
816,Jack and the Beanstalk,faucibus accumsan odio curabitur,Kendricks Bartosik,2012,Novel,English,Iceland,accumsan odio curabitur convallis duis consequat
817,The Town Mouse and the Country Mouse,eu massa,Joane Gress,1987,Short story,English,Russia,lectus vestibulum quam sapien varius ut
818,The Lion and the Mouse,ac enim in tempor turpis,Olivia Goforth,2011,Short story,English,Hungary,
819,The Grasshopper and the Ants,mattis egestas,Tracey Messier,2012,Novel,English,United States,a suscipit nulla elit ac nulla sed vel enim
820,Gingerbread Man,elementum ligula vehicula consequat morbi a,Trip Braidon,1998,Short story,English,Dominica,enim sit amet nunc viverra dapibus nulla suscipit ligula in lacus curabitur
821,The Teeny Tiny Woman,vel est donec odio justo,Kearney Farraway,1992,Short story,English,Italy,praesent id massa id
822,Seven Swabians,diam vitae quam suspendisse potenti,Norrie Ferroni,2000,Novel,English,Jamaica,suspendisse accumsan
823,The Princess and the Pea,in consequat ut nulla sed accumsan,Vally Gownge,1984,Novel,English,Malaysia,viverra pede ac diam
824,Trickster Tales,tristique in tempus sit,Port Pietz,2001,Short story,English,United Kingdom,metus aenean fermentum donec ut mauris eget massa
825,Stone Soup,lorem quisque ut erat,Philippine Splevings,1988,Novel,English,Dominica,quam pede lobortis ligula
826,The Fisherman and his Wife,consectetuer eget rutrum at lorem integer,Di Marchent,2001,Short story,English,Germany,libero non mattis pulvinar nulla pede ullamcorper augue a suscipit nulla elit
827,The Little Red Hen,pede venenatis non sodales sed tincidunt,Lisette Fenners,2008,Novel,English,Estonia,quisque arcu libero rutrum ac lobortis vel dapibus at diam nam tristique
828,Hans in Luck,in blandit ultrices,Kippy Bly,2004,Novel,English,Russia,elit sodales scelerisque mauris sit amet eros suspendisse accumsan tortor quis
829,Jack and the Beanstalk,proin risus,Markos Bonnick,2010,Novel,English,India,orci luctus et ultrices posuere cubilia
830,Fractured Fairy Tales,massa quis,Phylis Tolfrey,1989,Short story,English,Barbados,massa id nisl venenatis lacinia aenean sit
831,Hans in Luck,tincidunt eget tempus vel pede morbi,Von Cicetti,2000,Novel,English,Barbados,vel pede morbi porttitor lorem
832,Henny Penny,sem fusce,Alistair O'Neill,1993,Novel,English,Russia,
833,The Lion and the Mouse,nam ultrices,Gratiana Heater,2005,Short story,English,Serbia,sagittis nam congue risus
834,Stone Soup,ut mauris eget massa tempor convallis,Flori MacKinnon,2004,Novel,English,Jamaica,faucibus orci luctus et ultrices posuere cubilia curae duis faucibus accumsan odio
835,Fractured Fairy Tales,non mattis pulvinar nulla,Bryan Spatoni,2011,Novel,English,United States,sapien quis libero nullam sit amet turpis elementum ligula vehicula
836,Hans in Luck,ridiculus mus etiam vel augue vestibulum,Shalne Carik,2012,Short story,English,France,odio consequat
837,Cinderella,vestibulum rutrum rutrum neque aenean auctor,Nicholle Allott,1992,Short story,English,India,
838,Cinderella,nunc commodo placerat,Thaddus Johansson,2007,Short story,English,United States,ut nunc
839,Stone Soup,lectus aliquam sit,Quintin Kedge,1988,Novel,English,China,ipsum dolor sit amet consectetuer adipiscing elit proin interdum
840,Tom Thumb,vel lectus in quam,Tara Betham,2011,Novel,English,Spain,
841,The Town Mouse and the Country Mouse,ante ipsum,Flory McCabe,1998,Short story,English,Germany,ultrices vel
842,The Fox and the Grapes,eu felis,Nonnah Vick,1996,Novel,English,Sweden,turpis elementum ligula vehicula consequat morbi a
843,Fractured Fairy Tales,aliquam convallis nunc proin,Kipper Andryushchenko,2001,Short story,English,Nepal,faucibus accumsan odio curabitur convallis duis consequat dui nec nisi volutpat eleifend
844,Seven Swabians,nibh fusce lacus,Elspeth Lysons,2011,Novel,English,Malaysia,curae duis faucibus accumsan odio
845,Stone Soup,eu nibh quisque id justo sit,Elyssa D'Emanuele,2008,Novel,English,Serbia,imperdiet sapien urna pretium nisl ut
846,The Little Red Hen,vestibulum proin eu,Kipp Erangey,2004,Short story,English,Norway,
847,The Lion and the Mouse,ante ipsum primis in faucibus orci,Elsi Godsafe,2001,Novel,English,Hungary,sed interdum venenatis turpis enim blandit mi in porttitor
848,Fractured Fairy Tales,consectetuer adipiscing elit proin interdum mauris,Leon Gwinn,2007,Short story,English,Dominica,integer pede justo lacinia eget
849,Hansel and Gretel,habitasse platea dictumst aliquam,Traver Phillput,2005,Short story,English,United States,sit amet
850,The Town Mouse and the Country Mouse,tincidunt lacus at,Ulrick Hanhard,2003,Short story,English,Spain,a odio in hac habitasse platea dictumst maecenas ut
851,Stone Soup,leo maecenas pulvinar lobortis est,Rafaello Watkiss,2007,Short story,English,Romania,morbi non lectus aliquam sit amet diam in magna bibendum imperdiet
852,Sleeping Beauty,est donec odio justo sollicitudin,Kain Scoggans,1996,Short story,English,Serbia,praesent blandit nam nulla integer pede justo lacinia
853,Sleeping Beauty,leo odio condimentum,Em O'Giany,2010,Short story,English,Malaysia,sed sagittis nam congue risus semper porta volutpat quam
854,Trickster Tales,duis bibendum morbi non,Nealson Gemnett,2008,Novel,English,Sweden,bibendum felis sed interdum venenatis turpis enim blandit
855,Hansel and Gretel,nam ultrices libero non mattis,Minne Smalles,2011,Novel,English,Haiti,nisi at nibh in hac
856,The Bremen Town Musicians,sociis natoque penatibus et magnis dis,Caroljean Yorath,1997,Novel,English,Thailand,
857,Fractured Fairy Tales,lobortis vel dapibus at diam,Victor Gason,2011,Novel,English,Thailand,habitasse platea
858,The Town Mouse and the Country Mouse,vel nulla eget eros elementum pellentesque,Fania Eakle,1994,Novel,English,Italy,egestas metus aenean
859,Puss in Boots,ut mauris eget massa tempor,Lita Bayford,1984,Short story,English,Dominica,
860,Puss in Boots,lobortis est phasellus sit amet erat,Eduardo Curzey,1968,Novel,English,Iceland,
861,The Fisherman and his Wife,consequat lectus in est risus,Lindsy Gibben,1990,Short story,English,Hungary,integer a nibh in quis justo maecenas
862,Puss in Boots,at lorem integer tincidunt ante,Herbert Brach,2010,Short story,English,Estonia,
863,Gingerbread Man,eu mi nulla ac enim,Chicky Vouls,2013,Novel,English,Russia,ante vestibulum ante ipsum primis in faucibus
864,The Fox and the Grapes,libero quis orci nullam molestie,Ursa Bohills,2005,Short story,English,Grenada,erat vestibulum sed magna at nunc commodo placerat praesent
865,Hansel and Gretel,rutrum rutrum neque aenean auctor gravida,Sidney Starrs,2000,Novel,English,Nepal,justo lacinia eget tincidunt eget tempus
866,Seven Swabians,odio cras,Gifford Braybrook,1990,Novel,English,United States,risus dapibus augue vel accumsan tellus
867,Henny Penny,aliquam quis turpis eget elit,Shell Battrick,2011,Novel,English,Nepal,
868,The Bremen Town Musicians,lobortis vel dapibus at diam nam,Ardelis Jamary,2012,Novel,English,Haiti,
869,The Bremen Town Musicians,interdum venenatis,Chucho Kinnett,2012,Short story,English,India,vel accumsan tellus nisi eu orci mauris lacinia sapien
870,The Teeny Tiny Woman,quis turpis eget elit sodales,Allard Marcus,2008,Short story,English,Vietnam,amet consectetuer adipiscing elit proin interdum mauris non
871,The Town Mouse and the Country Mouse,et commodo vulputate justo in blandit,Carolynn Wilkie,2010,Novel,English,France,ipsum integer a nibh in quis justo maecenas
872,The Teeny Tiny Woman,augue vestibulum ante ipsum,Noelle Vinecombe,2010,Novel,English,China,lacus at velit vivamus vel
873,Aesops Fables,at dolor,Maddalena Dregan,2009,Novel,English,Vietnam,aenean lectus pellentesque eget nunc donec quis orci eget orci vehicula condimentum
874,The Princess and the Pea,tortor sollicitudin mi sit amet lobortis,Ritchie Bruhnicke,2006,Short story,English,China,consequat dui nec nisi volutpat eleifend donec ut
875,The Fisherman and his Wife,viverra pede ac,Ivan Wykey,2008,Short story,English,Hungary,vulputate luctus cum sociis natoque penatibus et magnis
876,Hansel and Gretel,vitae mattis nibh ligula,Katine Muncaster,2005,Short story,English,France,at nunc commodo placerat praesent blandit nam
877,The Town Mouse and the Country Mouse,pharetra magna vestibulum aliquet ultrices,Jannel Pears,2004,Short story,English,Thailand,eros suspendisse accumsan tortor quis turpis sed ante vivamus tortor duis mattis
878,Fractured Fairy Tales,rutrum nulla nunc,Tarrah Gershom,1998,Novel,English,Malaysia,
879,The Little Red Hen,vitae mattis nibh ligula,Berton Di Biaggi,2011,Short story,English,Turkey,mi integer ac neque duis
880,The Little Red Hen,cubilia curae donec pharetra magna,Cesya Riepel,2005,Short story,English,Dominica,
881,Stone Soup,in eleifend quam a odio in,Ferd Sharpling,2002,Short story,English,Iceland,ullamcorper augue a suscipit nulla elit
882,Jack and the Beanstalk,volutpat convallis morbi odio odio,Gretal Scollick,2007,Short story,English,Japan,curabitur at ipsum ac tellus semper interdum mauris ullamcorper purus sit
883,Little Red Riding Hood,orci luctus et ultrices posuere cubilia,Skip Philcott,1987,Short story,English,Malaysia,
884,Fractured Fairy Tales,varius nulla facilisi,Sutton Sline,2005,Short story,English,Sweden,
885,Brer Rabbit,mi nulla ac,Brittan Beernt,2003,Short story,English,Portugal,luctus nec
886,The Little Red Hen,arcu libero rutrum ac lobortis vel,Anton Meeson,2004,Novel,English,United States,eros elementum pellentesque quisque porta volutpat erat quisque erat
887,Brer Rabbit,quis orci nullam molestie nibh,Korney Bartens,2005,Short story,English,Nepal,donec diam neque vestibulum eget vulputate ut ultrices vel augue vestibulum ante
888,Hansel and Gretel,aliquam non,Thornton Brane,1983,Short story,English,India,
889,Fractured Fairy Tales,tempus vel pede,Perla Bennedick,1996,Novel,English,India,et eros vestibulum ac est lacinia nisi
890,Jack and the Beanstalk,ac consequat metus sapien,Salem Marxsen,2007,Novel,English,United Kingdom,consequat morbi a ipsum integer a nibh in quis justo
891,Ghost Stories,est lacinia nisi venenatis,Jory Pevsner,1992,Novel,English,Indonesia,ut erat curabitur gravida nisi at nibh in hac habitasse platea dictumst
892,The Princess and the Pea,rhoncus sed,Luise Chastang,2012,Short story,English,Malaysia,ut tellus nulla ut erat id mauris vulputate
893,Brer Rabbit,justo maecenas rhoncus,Orlan Paolucci,2010,Short story,English,Jamaica,
894,Brer Rabbit,orci nullam molestie nibh,Juditha Frounks,1995,Novel,English,Norway,magna bibendum imperdiet nullam orci pede venenatis non
895,The Bremen Town Musicians,donec quis orci eget orci vehicula,Stanley Ascrofte,2010,Short story,English,Norway,dis parturient montes nascetur ridiculus mus vivamus vestibulum
896,The Fox and the Grapes,nullam porttitor lacus at turpis,Lenard Guye,2012,Short story,English,France,metus vitae ipsum aliquam non
897,The Fox and the Grapes,urna ut tellus nulla ut,Madge Adolphine,2003,Short story,English,Estonia,sem praesent id massa id nisl venenatis
898,Little Red Riding Hood,mattis pulvinar nulla pede,Toni Buxey,2012,Short story,English,Barbados,erat nulla tempus vivamus in felis eu sapien cursus vestibulum
899,Brer Rabbit,vestibulum rutrum rutrum neque aenean auctor,Alla Sproul,2007,Novel,English,India,pellentesque ultrices mattis odio donec vitae nisi nam ultrices libero non mattis
900,Cinderella,justo sollicitudin ut suscipit a,Waylen Janda,2001,Short story,English,Turkey,
901,The Bremen Town Musicians,augue aliquam erat volutpat in,Noe Neachell,2011,Novel,English,Malaysia,
902,Goldilocks and the Three Bears,malesuada in imperdiet,Ashli Yakuntzov,1995,Short story,English,Dominica,rutrum at lorem integer tincidunt ante
903,Henny Penny,vestibulum vestibulum ante ipsum,Caty McCowen,2012,Short story,English,United States,sed interdum venenatis turpis enim blandit
904,Trickster Tales,tellus nisi eu orci,Audry Schuelcke,2003,Novel,English,Nepal,eget eleifend luctus ultricies
905,Hans in Luck,pretium quis lectus suspendisse,Cory Springell,1996,Short story,English,Norway,non quam
906,Sleeping Beauty,magna ac consequat metus sapien,Nannie Kybird,2006,Short story,English,China,venenatis turpis enim blandit mi
907,The Fox and the Grapes,venenatis non sodales sed tincidunt eu,Krystalle Jealous,2001,Novel,English,Japan,
908,Goldilocks and the Three Bears,eu est congue,Rosaline Petrello,2005,Novel,English,Nepal,etiam faucibus cursus urna ut tellus nulla ut
909,Seven Swabians,mi nulla ac,Patty Hasnney,2002,Short story,English,France,in faucibus
910,Trickster Tales,et tempus semper est quam pharetra,Land McFeat,2009,Short story,English,United States,morbi porttitor lorem id ligula suspendisse ornare consequat lectus in est
911,Hans in Luck,consequat in consequat,Rodie Bertome,1967,Novel,English,Russia,sit amet diam
912,The Little Red Hen,sodales sed,Shir Baake,2000,Short story,English,Turkey,amet sapien dignissim vestibulum
913,The Lion and the Mouse,pulvinar sed nisl nunc,Brana Thunnercliff,1994,Novel,English,Serbia,integer pede
914,Snow White,vestibulum ante ipsum primis in faucibus,Donica Clamp,2007,Short story,English,China,ullamcorper augue a
915,Sleeping Beauty,etiam vel augue,Dell Eskriet,1994,Short story,English,India,
916,Trickster Tales,molestie nibh,Sissie Gateland,2006,Novel,English,Serbia,ut blandit
917,Hans in Luck,amet erat nulla tempus vivamus,Christa Troup,1995,Novel,English,Iceland,blandit nam nulla integer
918,Fractured Fairy Tales,fermentum justo nec,Eloise Mingauld,1999,Short story,English,Hungary,et ultrices posuere
919,The Fox and the Grapes,tellus semper interdum mauris,Ilene Bredee,1992,Short story,English,Russia,tincidunt eu felis fusce
920,Jack and the Beanstalk,sed justo pellentesque viverra pede,Norrie Rutgers,2000,Short story,English,Hungary,eros viverra eget congue eget semper rutrum nulla nunc
921,Goldilocks and the Three Bears,ridiculus mus vivamus vestibulum sagittis sapien,Mozes Ilyasov,1992,Short story,English,France,erat fermentum justo nec condimentum neque sapien placerat ante nulla justo
922,The Princess and the Pea,in hac habitasse platea dictumst,Brigit Lazarus,1988,Short story,English,Thailand,nibh fusce lacus purus aliquet at feugiat
923,Sleeping Beauty,sed lacus morbi sem,Reese Colquite,2000,Novel,English,United States,curabitur at
924,Snow White,libero nullam sit,Emmalynn Butchart,1987,Novel,English,Iceland,
925,Little Red Riding Hood,at feugiat,De Bygrave,1997,Novel,English,Thailand,penatibus et magnis dis parturient montes nascetur ridiculus mus vivamus vestibulum sagittis
926,Tom Thumb,neque sapien placerat,Freida Ganter,2008,Novel,English,Haiti,eleifend donec ut dolor morbi vel lectus in quam
927,The Grasshopper and the Ants,suspendisse potenti nullam porttitor,Stanford Bawme,1995,Short story,English,Jamaica,donec ut mauris eget massa tempor convallis nulla neque libero convallis eget
928,The Fox and the Grapes,aenean fermentum donec,Alphonse Titmuss,1993,Novel,English,Haiti,ac lobortis vel
929,Puss in Boots,ipsum praesent blandit lacinia,Benedikta Brunel,2011,Short story,English,Iceland,augue a suscipit nulla elit ac nulla sed
930,The Bremen Town Musicians,viverra eget congue eget,Babbette Ruddlesden,1998,Short story,English,United States,interdum mauris non ligula pellentesque ultrices phasellus id
931,The Town Mouse and the Country Mouse,magna bibendum imperdiet nullam orci,Torrance Luckin,2003,Short story,English,Sweden,amet sem fusce consequat nulla nisl nunc nisl duis bibendum felis
932,The Lion and the Mouse,sed interdum venenatis turpis enim,Thomasine Bodycote,2012,Novel,English,Germany,consectetuer adipiscing elit proin interdum mauris non ligula pellentesque ultrices phasellus
933,Hansel and Gretel,vel dapibus,Brittaney Metterick,2012,Short story,English,Serbia,vestibulum sit amet cursus id turpis integer aliquet massa id
934,Hansel and Gretel,pellentesque at nulla suspendisse potenti,Greta Lattimore,2006,Short story,English,Germany,
935,Ghost Stories,hac habitasse,Betteanne Kyte,1996,Short story,English,Mexico,
936,Brer Rabbit,sed magna at nunc,Maye Matuskiewicz,1963,Short story,English,Japan,sed accumsan felis ut at dolor quis odio consequat varius integer
937,Rapunzel,vestibulum ante ipsum,Lorita Danielut,2003,Short story,English,Hungary,sapien iaculis congue vivamus metus arcu adipiscing molestie hendrerit
938,The Teeny Tiny Woman,quis justo maecenas rhoncus aliquam lacus,Orazio Jurasek,2005,Novel,English,Germany,vestibulum ante ipsum primis in faucibus orci luctus et ultrices
939,Gingerbread Man,sit amet,Collin Simmgen,2007,Short story,English,Thailand,amet eros suspendisse accumsan tortor quis turpis sed ante vivamus tortor duis
940,Ghost Stories,aliquam erat,Evy Crolly,2011,Novel,English,Italy,
941,Rapunzel,rutrum at lorem,Carmencita De Gregario,1992,Novel,English,Sweden,parturient montes nascetur ridiculus mus vivamus vestibulum sagittis sapien cum sociis natoque
942,Ghost Stories,sagittis nam congue,Valina Manclark,2009,Short story,English,Serbia,auctor sed tristique in tempus sit amet sem fusce consequat
943,The Teeny Tiny Woman,magna vulputate,Joby Eastham,1999,Short story,English,Iceland,ac tellus semper interdum mauris ullamcorper purus sit
944,The Ugly Duckling,at turpis,Halsey Kubat,2005,Short story,English,Indonesia,lacinia nisi venenatis
945,Snow White,turpis nec euismod scelerisque quam turpis,Jada Nickoll,1993,Novel,English,Turkey,
946,Hansel and Gretel,dictumst maecenas,Rina Burman,2003,Novel,English,United States,mauris vulputate elementum nullam varius
947,The Lion and the Mouse,sociis natoque penatibus et,Raye Fildes,2012,Short story,English,United Kingdom,neque vestibulum eget vulputate ut ultrices vel augue vestibulum
948,Snow White,mauris lacinia sapien quis libero,Beau Widmoor,1995,Short story,English,Japan,eu nibh quisque id justo sit
949,Hans in Luck,quam fringilla rhoncus,Shalne Cisson,1985,Short story,English,Romania,metus arcu adipiscing molestie hendrerit
950,The Grasshopper and the Ants,est quam pharetra magna ac consequat,Paquito Brundrett,2008,Novel,English,Singapore,nunc donec quis orci eget orci vehicula condimentum
951,The Fisherman and his Wife,suscipit a,Zondra Starie,2012,Novel,English,Norway,
952,Trickster Tales,adipiscing molestie hendrerit at,Jerry Marian,2006,Novel,English,Singapore,nulla justo aliquam quis turpis eget
953,Tom Thumb,aliquam sit amet diam,Stephi Frome,2002,Short story,English,Singapore,diam id
954,Puss in Boots,et tempus semper est quam pharetra,Tresa Caulder,1992,Short story,English,Romania,ac diam cras pellentesque volutpat dui maecenas tristique est et
955,Puss in Boots,in consequat,Jack Klimt,2010,Short story,English,Serbia,dignissim vestibulum vestibulum ante ipsum primis
956,Stone Soup,posuere cubilia curae duis faucibus accumsan,Gib Duddin,2013,Novel,English,Indonesia,arcu sed augue
957,Sleeping Beauty,velit donec diam neque,Mindy Bourgour,1992,Novel,English,Vietnam,pulvinar nulla pede
958,The Grasshopper and the Ants,in hac habitasse platea dictumst,Irita Mapother,2009,Novel,English,Japan,pretium quis lectus suspendisse potenti in
959,Henny Penny,nulla eget eros elementum pellentesque,Tori Viscovi,1996,Novel,English,Hungary,duis consequat dui nec nisi volutpat
960,Sleeping Beauty,ultrices posuere cubilia curae,Frederich Durram,1999,Novel,English,Spain,orci eget orci
961,Jack and the Beanstalk,et ultrices posuere cubilia curae,Saundra Newis,2004,Novel,English,Vietnam,justo etiam pretium iaculis justo in hac habitasse platea dictumst
962,Puss in Boots,in consequat ut nulla,Nickie Robberecht,1993,Novel,English,Nepal,magnis dis parturient montes nascetur ridiculus mus etiam vel augue vestibulum
963,Hans in Luck,tincidunt ante vel ipsum,Mallorie Troake,2002,Novel,English,Greece,
964,Hans in Luck,diam vitae quam suspendisse,Donnell Philpotts,1986,Novel,English,Spain,vivamus in felis eu sapien cursus vestibulum
965,The Town Mouse and the Country Mouse,nonummy integer non,Katti Discombe,1984,Novel,English,Portugal,
966,The Grasshopper and the Ants,nulla integer pede,Davis Rolingson,2003,Short story,English,Nepal,felis eu sapien cursus
967,Goldilocks and the Three Bears,sem mauris laoreet,Sol Conkling,2012,Short story,English,Germany,molestie sed
968,The Fisherman and his Wife,maecenas leo odio condimentum,Rafaela Bahls,2012,Short story,English,Malaysia,in eleifend quam a odio in
969,The Lion and the Mouse,diam id ornare imperdiet sapien,Guthry McFfaden,1986,Novel,English,Norway,justo pellentesque viverra pede ac diam cras pellentesque volutpat dui
970,Hansel and Gretel,convallis duis consequat dui nec nisi,Anastassia Poone,1990,Novel,English,Sweden,fusce posuere felis sed lacus morbi sem mauris laoreet ut rhoncus
971,The Fisherman and his Wife,porttitor lorem id ligula suspendisse,Aubrette Gheorghescu,1998,Novel,English,Romania,scelerisque mauris sit amet eros suspendisse accumsan tortor
972,Little Red Riding Hood,varius nulla facilisi cras non,Adina Prestige,1996,Novel,English,Portugal,neque duis bibendum morbi non quam nec dui luctus
973,Jack and the Beanstalk,eget massa tempor convallis,Brett O'Cosgra,1983,Novel,English,Haiti,sem sed sagittis nam congue risus semper porta volutpat quam pede
974,The Lion and the Mouse,est et tempus semper est quam,Bekki Mordin,1999,Short story,English,Malaysia,augue vestibulum ante ipsum primis in faucibus
975,Fractured Fairy Tales,quisque id justo sit,Duncan Wawer,2000,Novel,English,India,volutpat quam pede lobortis ligula sit amet eleifend pede libero quis
976,Seven Swabians,libero nullam sit amet,Phaedra Lindholm,2004,Short story,English,Norway,
977,Goldilocks and the Three Bears,tincidunt nulla mollis molestie,Sheila-kathryn Olyfant,2000,Short story,English,Estonia,primis in
978,Goldilocks and the Three Bears,semper est quam pharetra magna,Minor MacGee,2009,Novel,English,France,mattis odio donec vitae nisi nam ultrices libero non mattis
979,Gingerbread Man,faucibus orci luctus et,Eada Becconsall,2005,Novel,English,Thailand,mus vivamus vestibulum
980,Gingerbread Man,dignissim vestibulum,Meggie Filchagin,1996,Novel,English,Portugal,curabitur gravida nisi at nibh
981,Belling the Cat,sapien placerat ante nulla justo aliquam,Dorris Fawdery,1991,Novel,English,Barbados,sed lacus
982,Puss in Boots,integer a nibh in,Alidia Zanitti,1992,Novel,English,United States,praesent id massa id nisl venenatis
983,The Teeny Tiny Woman,bibendum morbi non,Aaron Gosford,1994,Short story,English,Japan,luctus et ultrices posuere cubilia curae nulla dapibus dolor vel est
984,Cinderella,ornare imperdiet sapien urna,Stevie Sturdgess,1997,Short story,English,Greece,ante ipsum primis in faucibus orci luctus et ultrices posuere cubilia curae
985,The Ugly Duckling,rutrum nulla tellus,Biddie Helks,2010,Short story,English,Grenada,tristique in tempus
986,Gingerbread Man,ut nulla,Melly Whitfield,2003,Novel,English,Turkey,risus dapibus augue vel accumsan tellus nisi eu orci
987,Gingerbread Man,cras mi pede malesuada in,Martie Fallanche,1994,Short story,English,Nepal,vel lectus in quam
988,The Grasshopper and the Ants,aliquam sit amet diam,Tatum Bindin,2001,Short story,English,Malaysia,potenti nullam porttitor lacus at turpis donec posuere metus vitae ipsum aliquam
989,Snow White,eu magna vulputate,Sande Dunbleton,2006,Novel,English,Estonia,sed sagittis nam congue risus semper porta
